{
  "$schema": "./schemas/marketplace.schema.json",
  "schemaVersion": 2,
  "id": "otto-plugins",
  "displayName": "Otto's plugins",
  "description": "Personal plugins, skills, and tools for agentic coding harnesses.",
  "repository": "https://github.com/oovz/plugins",
  "owner": {
    "name": "Otto",
    "url": "https://github.com/oovz/plugins"
  },
  "plugins": [
    "senior-engineering-workflow",
    "tauri-v2-desktop",
    "chrome-extension-tester"
  ],
  "skills": [
    "senior-engineering-workflow",
    "tauri-v2-desktop",
    "chrome-extension-test",
    "wxt-extension-test"
  ]
}
